{
  "$schema": "schema/video_process_codes.schema.json",
  "artifact": "process_codes",
  "student_id": "Ulysses",
  "cohort_year": 2026,
  "schema_version": "1.0",
  "generated_at": "2026-07-21T11:43:10.493823+00:00",
  "codebook_id": "VIDEO_PROCESS_CODEBOOK_v1",
  "interpretation_rule": "Episode-level V-codes support process interpretation and ML feature engineering. They are not proficiency scores. Heuristic decisions from expert narrative require human adjudication.",
  "episodes": [
    {
      "episode_id": "ep_0000",
      "step_indices": [
        0
      ],
      "dominant_category": "EXPLORE",
      "anchor_event": null,
      "start_ms": 37299,
      "end_ms": 37299,
      "assistance_status": "independent",
      "process_codes": {
        "V1A_systematic_iteration": {
          "decision": "not_observed",
          "evidence": [],
          "evidence_sources": [],
          "step_indices": [],
          "log_corroboration": null
        },
        "V1B_chaotic_iteration": {
          "decision": "not_observed",
          "evidence": [],
          "evidence_sources": [],
          "step_indices": [],
          "log_corroboration": null
        },
        "V2A_hesitation_disorientation": {
          "decision": "not_observed",
          "evidence": [],
          "evidence_sources": [],
          "step_indices": [],
          "log_corroboration": null
        },
        "V2B_interface_cycling": {
          "decision": "not_observed",
          "evidence": [],
          "evidence_sources": [],
          "step_indices": [],
          "log_corroboration": null
        },
        "V3A_sustained_engagement": {
          "decision": "not_observed",
          "evidence": [],
          "evidence_sources": [],
          "step_indices": [],
          "log_corroboration": null
        },
        "V3B_disengagement_passivity": {
          "decision": "not_observed",
          "evidence": [],
          "evidence_sources": [],
          "step_indices": [],
          "log_corroboration": null
        },
        "V4A_productive_recovery": {
          "decision": "not_observed",
          "evidence": [],
          "evidence_sources": [],
          "step_indices": [],
          "log_corroboration": null
        },
        "V4B_dead_end_loop": {
          "decision": "not_observed",
          "evidence": [],
          "evidence_sources": [],
          "step_indices": [],
          "log_corroboration": null
        },
        "V5A_productive_help_seeking": {
          "decision": "not_observed",
          "evidence": [],
          "evidence_sources": [],
          "step_indices": [],
          "log_corroboration": null
        },
        "V5B_dependent_execution": {
          "decision": "not_observed",
          "evidence": [],
          "evidence_sources": [],
          "step_indices": [],
          "log_corroboration": null
        },
        "V6A_mcr_zero_targeting": {
          "decision": "not_observed",
          "evidence": [],
          "evidence_sources": [],
          "step_indices": [],
          "log_corroboration": null
        },
        "V6B_label_inversion": {
          "decision": "not_observed",
          "evidence": [],
          "evidence_sources": [],
          "step_indices": [],
          "log_corroboration": null
        },
        "V6C_metric_scope_awareness": {
          "decision": "not_observed",
          "evidence": [],
          "evidence_sources": [],
          "step_indices": [],
          "log_corroboration": null
        },
        "V7A_no_metric_inspection": {
          "decision": "not_observed",
          "evidence": [],
          "evidence_sources": [],
          "step_indices": [],
          "log_corroboration": null
        },
        "V7B_no_graph_reading": {
          "decision": "not_observed",
          "evidence": [],
          "evidence_sources": [],
          "step_indices": [],
          "log_corroboration": null
        },
        "V7C_no_comparison_despite_opportunity": {
          "decision": "not_observed",
          "evidence": [],
          "evidence_sources": [],
          "step_indices": [],
          "log_corroboration": null
        },
        "V8A_multi_instance_benchmarking": {
          "decision": "not_observed",
          "evidence": [],
          "evidence_sources": [],
          "step_indices": [],
          "log_corroboration": null
        },
        "V8B_table_sort_threshold": {
          "decision": "not_observed",
          "evidence": [],
          "evidence_sources": [],
          "step_indices": [],
          "log_corroboration": null
        },
        "V8C_ctr_in_place_edit": {
          "decision": "not_observed",
          "evidence": [],
          "evidence_sources": [],
          "step_indices": [],
          "log_corroboration": null
        },
        "V8D_import_failure_recovery": {
          "decision": "not_observed",
          "evidence": [],
          "evidence_sources": [],
          "step_indices": [],
          "log_corroboration": null
        }
      },
      "notes": null
    }
  ],
  "session_summary": {
    "episode_count": 1,
    "codes_observed": [],
    "codes_not_observed": [
      "V1A_systematic_iteration",
      "V1B_chaotic_iteration",
      "V2A_hesitation_disorientation",
      "V2B_interface_cycling",
      "V3A_sustained_engagement",
      "V3B_disengagement_passivity",
      "V4A_productive_recovery",
      "V4B_dead_end_loop",
      "V5A_productive_help_seeking",
      "V5B_dependent_execution",
      "V6A_mcr_zero_targeting",
      "V6B_label_inversion",
      "V6C_metric_scope_awareness",
      "V7A_no_metric_inspection",
      "V7B_no_graph_reading",
      "V7C_no_comparison_despite_opportunity",
      "V8A_multi_instance_benchmarking",
      "V8B_table_sort_threshold",
      "V8C_ctr_in_place_edit",
      "V8D_import_failure_recovery"
    ],
    "codes_not_measurable": [],
    "rubric_gap_ids": []
  },
  "ml_feature_flags": {
    "systematic_iteration_present": false,
    "chaotic_iteration_present": false,
    "hesitation_episode_present": false,
    "interface_cycling_present": false,
    "sustained_engagement_present": false,
    "disengagement_present": false,
    "productive_recovery_present": false,
    "dead_end_loop_present": false,
    "productive_help_seeking_present": false,
    "dependent_execution_present": false,
    "mcr_zero_targeting_present": false,
    "label_inversion_present": false,
    "metric_scope_awareness_present": false,
    "metric_inspection_absent_after_emit": false,
    "graph_reading_absent": false,
    "comparison_absent_despite_opportunity": false,
    "multi_instance_strategy_present": false,
    "table_sort_threshold_present": false,
    "ctr_in_place_edit_present": false,
    "import_failure_recovery_present": false
  }
}
